{
  "schemaVersion": "2.0",
  "requestId": "11111111-1111-4111-8111-111111111111",
  "deviceId": "22222222-2222-4222-8222-222222222222",
  "brokerConnectionId": "33333333-3333-4333-8333-333333333333",
  "provider": "FUTU",
  "purpose": "SINGLE_DECISION",
  "capturedAt": "2026-09-17T02:00:00.000Z",
  "expiresAt": "2026-09-17T02:01:00.000Z",
  "sequence": 1,
  "account": {
    "accountIdHash": "aaaaaaaaaaaaaaaaaaaaaaaaaaaaaaaaaaaaaaaaaaaaaaaaaaaaaaaaaaaaaaaa",
    "broker": "FUTU",
    "environment": "SIMULATE",
    "totalAssets": { "value": "100000.00", "currency": "HKD" },
    "cash": { "value": "80000.00", "currency": "HKD" },
    "buyingPower": { "value": "120000.00", "currency": "HKD" }
  },
  "positions": [
    {
      "symbol": "US.AAPL",
      "market": "US",
      "side": "LONG",
      "quantity": "10",
      "availableQuantity": "10",
      "costPrice": "220.00",
      "lastPrice": "225.00",
      "currency": "USD"
    }
  ],
  "marketSessions": [
    {
      "market": "US",
      "state": "OPEN",
      "sourceAt": "2026-09-17T02:00:00.000Z"
    }
  ],
  "quotes": [
    {
      "symbol": "US.AAPL",
      "market": "US",
      "sourceAt": "2026-09-17T02:00:00.000Z",
      "lastPrice": "225.00",
      "bidPrice": "224.99",
      "askPrice": "225.01",
      "lotSize": 1
    }
  ],
  "minuteBars": [],
  "tickerPoints": [],
  "orderBooks": [],
  "openOrders": [],
  "recentDeals": [],
  "capabilities": [],
  "researchPoolVersion": 1,
  "tradingConfigVersion": 1,
  "catalogVersion": "2026.09.1",
  "tradingSessionId": null,
  "requestedSymbols": ["US.AAPL"],
  "clientPolicyVersion": "macos-v2",
  "dataGaps": ["示例夹具未包含逐笔与盘口"],
  "contentHash": "283731607c54ed949c1b65e1fc108cf4b410aa0a0c5ae9be6d43a9b7c6c3fbdc",
  "deviceSignature": "Dq9jhvbPcXSdIKf9lcaHwPi4G2xeB0-MUy4qcCwaU82oVvbvAqsHPiGSPyRTgmYaodaW-LFNfMdbV2YjGk5LBw"
}
